{
  "format": 1,
  "kind": "design",
  "name": "Acme library",
  "uses": {
    "tokens": [".sigma/tokens/acme.sigma.json"],
    "icons": [".sigma/icons/acme-icons.sigma.json"]
  },
  "pages": [
    {
      "id": "components",
      "name": "Components",
      "background": "#F5F5F5",
      "children": [
        {
          "id": "button",
          "type": "componentSet",
          "name": "Button",
          "description": "src/components/button.js: Button({ label, variant, icon, disabled }); styles in .button",
          "clip": false,
          "codeName": "Button",
          "codeNames": { "State": "state", "Variant": "variant" },
          "docs": {
            "code": "src/components/button.js",
            "notFor": "Navigation (use a link) or toggles (use a switch).",
            "purpose": "The main action in a section: one primary button per view.",
            "usage": "Label with a verb (\"Save\", \"Continue\"). Secondary for the less important action next to a primary one; Danger for actions that delete."
          },
          "h": 180,
          "props": {
            "button-label": {
              "type": "text",
              "name": "Label",
              "codeName": "label",
              "default": "Continue"
            },
            "button-show-icon": {
              "type": "boolean",
              "name": "Show icon",
              "codeName": "icon",
              "default": true
            },
            "button-icon": {
              "type": "icon",
              "name": "Icon",
              "codeName": "icon",
              "default": "arrows-arrow-right"
            }
          },
          "w": 587.28,
          "x": 40,
          "y": 40,
          "children": [
            {
              "id": "button-variant-primary-state-default",
              "type": "component",
              "name": "Variant=Primary, State=Default",
              "bindings": {
                "fills.0.color": "accent",
                "layout.gap": "space-2",
                "layout.pb": "space-2",
                "layout.pt": "space-2",
                "radius": "radius-md"
              },
              "clip": false,
              "fills": [{}],
              "layout": { "alignC": "center", "mode": "horizontal", "pl": 16, "pr": 16 },
              "sizingH": "hug",
              "sizingV": "hug",
              "x": 20,
              "y": 20,
              "children": [
                {
                  "id": "button-variant-primary-state-default-icon-0",
                  "type": "icon",
                  "name": "Icon",
                  "bindings": { "fills.0.color": "color-gray-0" },
                  "fills": [{}],
                  "h": 16,
                  "iconId": "arrows-arrow-right",
                  "propRefs": { "iconId": "button-icon", "visible": "button-show-icon" },
                  "w": 16
                },
                {
                  "id": "button-variant-primary-state-default-label-1",
                  "type": "text",
                  "name": "Label",
                  "bindings": { "fills.0.color": "color-gray-0", "fontWeight": "font-weight-bold" },
                  "fills": [{}],
                  "fontFamily": "Arial",
                  "fontSize": 13.33,
                  "propRefs": { "text": "button-label" },
                  "text": "Continue",
                  "textAlign": "center"
                }
              ]
            },
            {
              "id": "yuowhkiu",
              "type": "component",
              "name": "Variant=Secondary, State=Default",
              "bindings": {
                "fills.0.color": "surface-sunken",
                "layout.gap": "space-2",
                "layout.pb": "space-2",
                "layout.pt": "space-2",
                "radius": "radius-md"
              },
              "clip": false,
              "fills": [{}],
              "layout": { "alignC": "center", "mode": "horizontal", "pl": 16, "pr": 16 },
              "sizingH": "hug",
              "sizingV": "hug",
              "x": 20,
              "y": 128,
              "children": [
                {
                  "id": "elf8brxf",
                  "type": "icon",
                  "name": "Icon",
                  "bindings": { "fills.0.color": "accent" },
                  "fills": [{}],
                  "h": 16,
                  "iconId": "arrows-arrow-right",
                  "propRefs": { "iconId": "button-icon", "visible": "button-show-icon" },
                  "w": 16
                },
                {
                  "id": "uhvn7ert",
                  "type": "text",
                  "name": "Label",
                  "bindings": { "fills.0.color": "accent", "fontWeight": "font-weight-bold" },
                  "fills": [{}],
                  "fontFamily": "Arial",
                  "fontSize": 13.33,
                  "propRefs": { "text": "button-label" },
                  "text": "Continue",
                  "textAlign": "center"
                }
              ]
            },
            {
              "id": "button-variant-primary-state-hover",
              "type": "component",
              "name": "Variant=Primary, State=Hover",
              "bindings": {
                "fills.0.color": "accent-hover",
                "layout.gap": "space-2",
                "layout.pb": "space-2",
                "layout.pt": "space-2",
                "radius": "radius-md"
              },
              "clip": false,
              "fills": [{}],
              "layout": { "alignC": "center", "mode": "horizontal", "pl": 16, "pr": 16 },
              "sizingH": "hug",
              "sizingV": "hug",
              "x": 165.76,
              "y": 20,
              "children": [
                {
                  "id": "button-variant-primary-state-hover-icon-0",
                  "type": "icon",
                  "name": "Icon",
                  "bindings": { "fills.0.color": "color-gray-0" },
                  "fills": [{}],
                  "h": 16,
                  "iconId": "arrows-arrow-right",
                  "propRefs": { "iconId": "button-icon", "visible": "button-show-icon" },
                  "w": 16
                },
                {
                  "id": "button-variant-primary-state-hover-label-1",
                  "type": "text",
                  "name": "Label",
                  "bindings": { "fills.0.color": "color-gray-0", "fontWeight": "font-weight-bold" },
                  "fills": [{}],
                  "fontFamily": "Arial",
                  "fontSize": 13.33,
                  "propRefs": { "text": "button-label" },
                  "text": "Continue",
                  "textAlign": "center"
                }
              ]
            },
            {
              "id": "zyie06i8",
              "type": "component",
              "name": "Variant=Secondary, State=Hover",
              "bindings": {
                "fills.0.color": "surface",
                "layout.gap": "space-2",
                "layout.pb": "space-2",
                "layout.pt": "space-2",
                "radius": "radius-md"
              },
              "clip": false,
              "fills": [{}],
              "layout": { "alignC": "center", "mode": "horizontal", "pl": 16, "pr": 16 },
              "sizingH": "hug",
              "sizingV": "hug",
              "x": 165.76,
              "y": 128,
              "children": [
                {
                  "id": "4np35mri",
                  "type": "icon",
                  "name": "Icon",
                  "bindings": { "fills.0.color": "accent" },
                  "fills": [{}],
                  "h": 16,
                  "iconId": "arrows-arrow-right",
                  "propRefs": { "iconId": "button-icon", "visible": "button-show-icon" },
                  "w": 16
                },
                {
                  "id": "yxr8n0ie",
                  "type": "text",
                  "name": "Label",
                  "bindings": { "fills.0.color": "accent", "fontWeight": "font-weight-bold" },
                  "fills": [{}],
                  "fontFamily": "Arial",
                  "fontSize": 13.33,
                  "propRefs": { "text": "button-label" },
                  "text": "Continue",
                  "textAlign": "center"
                }
              ]
            },
            {
              "id": "button-variant-primary-state-focus",
              "type": "component",
              "name": "Variant=Primary, State=Focus",
              "bindings": {
                "fills.0.color": "accent",
                "layout.gap": "space-2",
                "layout.pb": "space-2",
                "layout.pt": "space-2",
                "radius": "radius-md",
                "strokes.0.color": "accent"
              },
              "clip": false,
              "fills": [{}],
              "layout": { "alignC": "center", "mode": "horizontal", "pl": 16, "pr": 16 },
              "sizingH": "hug",
              "sizingV": "hug",
              "strokeAlign": "outside",
              "strokeWidth": 2,
              "strokes": [{}],
              "x": 311.52,
              "y": 20,
              "children": [
                {
                  "id": "button-variant-primary-state-focus-icon-0",
                  "type": "icon",
                  "name": "Icon",
                  "bindings": { "fills.0.color": "color-gray-0" },
                  "fills": [{}],
                  "h": 16,
                  "iconId": "arrows-arrow-right",
                  "propRefs": { "iconId": "button-icon", "visible": "button-show-icon" },
                  "w": 16
                },
                {
                  "id": "button-variant-primary-state-focus-label-1",
                  "type": "text",
                  "name": "Label",
                  "bindings": { "fills.0.color": "color-gray-0", "fontWeight": "font-weight-bold" },